{
  "schema_version": 1,
  "artifact_id": "style_s0001",
  "content_hash": "sha256:9c34662d7a08fcba34206a99a50093ee158ef79beb0a95729f26d93bc3516b43",
  "preset": "film_noir",
  "preset_version": 1,
  "directives": "Black-and-white film noir still: hard low-key light from a single source, deep black shadows, high contrast, wet reflective surfaces, 1940s crime-film composition"
}
